{
 "head_sha": "a2bd2f00aaf7729eebb2f66836f3efb1d41a0f75",
 "posted_at": "2026-10-28T12:26:36.878415+00:00",
 "pr": 22278,
 "repo": "TauCetiProject/TauCeti",
 "round": 1,
 "schema": "tauceti.post/v1",
 "scoreboard_body_sha256": "e7164856820289ef137b30ff710befb02d60799c68aa5b4d55924d51eb694cf6",
 "scoreboard_comment_id": 6468943324,
 "threads": {
  "naming": 4400514579,
  "proof-quality": 4400514882,
  "reuse": 4400514303
 }
}
