{
 "head_sha": "b28a7f822a65b9f68dc05954232d09516c768f0d",
 "posted_at": "2026-06-21T17:34:48.224856+00:00",
 "pr": 301,
 "repo": "FormalFrontier/TauCeti",
 "round": 13,
 "schema": "tauceti.post/v1",
 "scoreboard_body_sha256": "d003c3d179cd572bd27c5273fc5a9c8399f82f73592b8f7a666edc2f9e6490ea",
 "scoreboard_comment_id": 4762004890
}
