{
 "head_sha": "ef332310e8a76b22c3d757699c63374be8bfb9e2",
 "posted_at": "2026-09-13T10:48:44.540293+00:00",
 "pr": 6504,
 "repo": "TauCetiProject/TauCeti",
 "round": 3,
 "schema": "tauceti.post/v1",
 "scoreboard_body_sha256": "e3050828cf966d31c9016550faacef1d16cc776df0ce6ca1be374dde1b8171c1",
 "scoreboard_comment_id": 5650138221,
 "threads": {
  "api-design": 3998354272,
  "attribution": 3998354248,
  "documentation": 3998354367,
  "naming": 3998354335,
  "placement": 3998354299,
  "proof-quality": 3998354386
 }
}
