{
 "head_sha": "216a5d947433aca19a4b068ef08d91a9b4cad7d2",
 "posted_at": "2026-10-27T18:51:46.077195+00:00",
 "pr": 21850,
 "repo": "TauCetiProject/TauCeti",
 "round": 1,
 "schema": "tauceti.post/v1",
 "scoreboard_body_sha256": "d5017d7a4fdd77d187462b754f77e216809734ddd54d145bbf0b2282a4fd77a6",
 "scoreboard_comment_id": 6450803748
}
