{
 "head_sha": "49fafe231ca71970488d868ad1e683b8e15ac06f",
 "posted_at": "2026-07-02T17:55:59.630329+00:00",
 "pr": 612,
 "repo": "TauCetiProject/TauCeti",
 "round": 5,
 "schema": "tauceti.post/v1",
 "scoreboard_body_sha256": "80058eb3039d3a74f745993d68e82e8e8b22fb33900ca3eb2947892dfacf74c0",
 "scoreboard_comment_id": 4861916860,
 "threads": {
  "api-design": 3510569346,
  "documentation": 3510569388
 }
}
