{
 "failures": [
  {
   "action": "required thread discovery",
   "error": "could not list review roots"
  }
 ],
 "head_sha": "74336a0618d5b73429cc1981035f7d4148bb3e9b",
 "posted_at": "2026-10-28T19:31:19.133655+00:00",
 "pr": 22394,
 "repo": "TauCetiProject/TauCeti",
 "round": 1,
 "schema": "tauceti.post/v1",
 "scoreboard_body_sha256": "02fa72c1f35ba426f877d1eb3ad9b4ec634e452e528411b7b157bf1a6db6164c"
}
