{
 "head_sha": "64db9a1acedf302c7d72393c7bf79c0f8f911704",
 "posted_at": "2026-10-10T02:35:45.201382+00:00",
 "pr": 14041,
 "repo": "TauCetiProject/TauCeti",
 "round": 1,
 "schema": "tauceti.post/v1",
 "scoreboard_body_sha256": "3f4915691e6a3981cc9932f6f61ac0d5b06be4c7f9274d349eaa1e0226e90b86",
 "scoreboard_comment_id": 6092820809,
 "threads": {
  "naming": 4236061135,
  "reuse": 4236061050
 }
}
