{
 "head_sha": "7d3ec6caf3b39d68948eac1d355594393594df4b",
 "posted_at": "2026-06-21T20:01:40.970082+00:00",
 "pr": 306,
 "repo": "FormalFrontier/TauCeti",
 "round": 13,
 "schema": "tauceti.post/v1",
 "scoreboard_body_sha256": "10e658e4e7b82e6698f34c6130115cf40da9849997dbd36e62d6920dc433289c",
 "scoreboard_comment_id": 4762928508
}
