{
 "head_sha": "e42d3a494da3e2e6ada0a76c13a22a2f75cb985b",
 "posted_at": "2026-10-27T10:02:58.968027+00:00",
 "pr": 21628,
 "repo": "TauCetiProject/TauCeti",
 "round": 2,
 "schema": "tauceti.post/v1",
 "scoreboard_body_sha256": "3c0b79638931a74d66926118a3cf630415da1190ebf37cd289b18753aaafef80",
 "scoreboard_comment_id": 6438410048,
 "threads": {
  "placement": 4387095327
 }
}
