{
 "head_sha": "dc47c5f3b6e4493d293eb09c0edcfcdcca7a7cbb",
 "posted_at": "2026-06-21T22:06:11.797661+00:00",
 "pr": 302,
 "repo": "FormalFrontier/TauCeti",
 "round": 13,
 "schema": "tauceti.post/v1",
 "scoreboard_body_sha256": "239ac2eb5f0db903f4f52fa3f0c84ddd44ec82f202acf7b11c3116ab176c0032",
 "scoreboard_comment_id": 4762003626
}
