{
 "head_sha": "f3c01280902e2a320a5fdc9daa308dcf81ddf396",
 "posted_at": "2026-09-28T09:19:14.045486+00:00",
 "pr": 9694,
 "repo": "TauCetiProject/TauCeti",
 "round": 2,
 "schema": "tauceti.post/v1",
 "scoreboard_body_sha256": "a4706004cf7a2f2d7ac37d162a3596f3e8c1e6c48508c671300780bfcc15d22d",
 "scoreboard_comment_id": 5866548572,
 "threads": {
  "api-design": 4120178201,
  "api-design:reply": 4120457742,
  "documentation": 4120178529,
  "documentation:reply": 4120458714,
  "generality": 4120178297,
  "generality:reply": 4120458237,
  "naming": 4120178423,
  "naming:reply": 4120458464,
  "proof-quality": 4120178631,
  "proof-quality:reply": 4120459249,
  "reuse": 4120178095,
  "reuse:reply": 4120457459
 }
}
