{
 "head_sha": "84852905ad003ed9dce4374236bb2b9fef91360e",
 "posted_at": "2026-09-12T07:58:55.521837+00:00",
 "pr": 6367,
 "repo": "TauCetiProject/TauCeti",
 "round": 1,
 "schema": "tauceti.post/v1",
 "scoreboard_body_sha256": "a87abfadec634e4fa788413b6927401e8a9d628d63d74beed2242a299a73cd5e",
 "scoreboard_comment_id": 5644599907
}
