{
 "head_sha": "7ec2a3cf8cd76617e076c228ea953b61cbb6b46f",
 "posted_at": "2026-10-27T08:25:35.805640+00:00",
 "pr": 15943,
 "repo": "TauCetiProject/TauCeti",
 "round": 2,
 "schema": "tauceti.post/v1",
 "scoreboard_body_sha256": "920753ff80d008f64417629ec915d1a2a3022aa51d008d61bb059a720c87ffb0",
 "scoreboard_comment_id": 6436266716,
 "threads": {
  "placement": 4386095190
 }
}
