{
 "head_sha": "5b565d20cb2ae8c4bcbe477c191ef93b8373554a",
 "posted_at": "2026-06-24T16:44:08.219782+00:00",
 "pr": 410,
 "repo": "FormalFrontier/TauCeti",
 "round": 8,
 "schema": "tauceti.post/v1",
 "scoreboard_body_sha256": "3a6c9d87e6e4f9d0ca796b5a9fae365217ae61347357de34c7a31bbae93d4b6a",
 "scoreboard_comment_id": 4791289860
}
