{
 "head_sha": "ffa51a6845897f9a38504f4e1c2b40e82c6b4205",
 "posted_at": "2026-07-01T22:24:01.820956+00:00",
 "pr": 604,
 "repo": "TauCetiProject/TauCeti",
 "round": 1,
 "schema": "tauceti.post/v1",
 "scoreboard_body_sha256": "7aa6f90d0f5abf41b2656cd8de07f15306db856ad52633646742d3427c2d5d5b",
 "scoreboard_comment_id": 4860512927,
 "threads": {
  "attribution": 3509369706
 }
}
