{
 "head_sha": "ec506eb1b88e319a7ea8652575fc75b48954f00b",
 "posted_at": "2026-10-22T05:40:32.764024+00:00",
 "pr": 19843,
 "repo": "TauCetiProject/TauCeti",
 "round": 1,
 "schema": "tauceti.post/v1",
 "scoreboard_body_sha256": "2612313fb5395fa657f0a2aad0d091e6fb18119ec59c30250c6eb7d65b530164",
 "scoreboard_comment_id": 6333647130,
 "threads": {
  "api-design:reply": 4344923824
 }
}
