{
 "head_sha": "f2ad6706c50c127043501c9e0ebebbcd834cfe98",
 "posted_at": "2026-08-15T10:49:59.436064+00:00",
 "pr": 3347,
 "repo": "TauCetiProject/TauCeti",
 "round": 1,
 "schema": "tauceti.post/v1",
 "scoreboard_body_sha256": "ff08ce5e72ee09d056f0c4aa316fd67371ed55dd0af343dc2c50abfaa3446c7e",
 "scoreboard_comment_id": 5301889765,
 "threads": {
  "api-design": 3789215120,
  "attribution": 3789215083,
  "correctness": 3789215016,
  "documentation": 3789215217,
  "generality": 3789215152,
  "placement": 3789215183,
  "proof-quality": 3789215245,
  "reuse": 3789215043,
  "scope": 3789215065
 }
}
