{
 "head_sha": "d2ed99fd395b004da0fcf753b7beb064e43e3ae4",
 "posted_at": "2026-10-23T10:18:53.308450+00:00",
 "pr": 20060,
 "repo": "TauCetiProject/TauCeti",
 "round": 1,
 "schema": "tauceti.post/v1",
 "scoreboard_body_sha256": "bcf532726c84396e0bb29f4ef048fa3cd35142a41998ba2db002e144b779b43b",
 "scoreboard_comment_id": 6362677631,
 "threads": {
  "generality": 4358489305
 }
}
