{
 "head_sha": "1ec91ab105963876e18b2e6094ad61bb9425067d",
 "posted_at": "2026-09-10T18:48:08.936572+00:00",
 "pr": 6198,
 "repo": "TauCetiProject/TauCeti",
 "round": 2,
 "schema": "tauceti.post/v1",
 "scoreboard_body_sha256": "3191c168a9be6e9caf043458a5f95dad5f1b3d32a61337fffb6baecb19bdb803",
 "scoreboard_comment_id": 5622219847,
 "threads": {
  "api-design": 3981432512,
  "api-design:reply": 3982411142,
  "proof-quality": 3981432738,
  "reuse": 3981432309,
  "reuse:reply": 3982410928
 }
}
