{
 "head_sha": "a1a536f0f1122fce54c8dd91d10a62921cd42beb",
 "posted_at": "2026-06-22T13:47:55.216854+00:00",
 "pr": 273,
 "repo": "FormalFrontier/TauCeti",
 "round": 1,
 "schema": "tauceti.post/v1",
 "scoreboard_body_sha256": "c0c0dcc61ed9e633bd1f8911c5626577796296c9db93e355ae9112c34ad2e778",
 "scoreboard_comment_id": 4760308684,
 "threads": {
  "api-design": 3452700435,
  "documentation": 3452700668,
  "generality": 3449431509,
  "proof-quality": 3452700761
 }
}
