{
 "head_sha": "f4a06b19da7a88201e7092448ac840bf2db2dd20",
 "posted_at": "2026-10-21T18:35:46.480500+00:00",
 "pr": 19621,
 "repo": "TauCetiProject/TauCeti",
 "round": 1,
 "schema": "tauceti.post/v1",
 "scoreboard_body_sha256": "63df18cfdf816791c7c993533ae96a11c65919f8fe4b5c7eb7a439ea60d4dbb8",
 "scoreboard_comment_id": 6323622487,
 "threads": {
  "api-design:reply": 4340533070
 }
}
