{
 "head_sha": "f16143c4136cf0c88526e6f93441f37c28149300",
 "posted_at": "2026-09-18T09:43:10.933243+00:00",
 "pr": 6583,
 "repo": "TauCetiProject/TauCeti",
 "round": 2,
 "schema": "tauceti.post/v1",
 "scoreboard_body_sha256": "c9d023d118fe7854794dc8b74a782c4e6a8fc7aaf73f35edc082dbd2a86a36c5",
 "scoreboard_comment_id": 5655262707,
 "threads": {
  "api-design": 4000496206,
  "api-design:reply": 4045609098,
  "naming": 4000496302,
  "naming:reply": 4045609351
 }
}
